<?xml version="1.0" encoding="UTF-8"?>
<server
	xmlns="http://www.weblab.deusto.es/configuration" 
	xmlns:xsi="http://www.w3.org/2001/XMLSchema-instance"
	xsi:schemaLocation="http://www.weblab.deusto.es/configuration server_configuration.xsd"
>

	<configuration file="server_config.py" />

	<type>weblab.data.server_type::Laboratory</type>
	<methods>weblab.methods::Laboratory</methods>

	<implementation>weblab.lab.server.LaboratoryServer</implementation>

	<!-- <restriction>something else</restriction> -->

	<protocols>
		<!-- This server supports both Direct calls, as SOAP calls -->
		<protocol name="Direct">
			<coordinations>
				<coordination></coordination>
			</coordinations>
			<creation></creation>
		</protocol>
		<protocol name="SOAP">
			<coordinations>
				<coordination>
					<parameter name="address" value="127.0.0.1:10029@PLD" />
				</coordination>
				<!-- <coordination>
					<parameter name="address" value="192.168.0.1:10029@LABORATORYNETWORK" />
				</coordination>
				<coordination>
					<parameter name="address" value="130.206.100.16:10029@INTERNET" />
				</coordination> -->
			</coordinations>
			<creation>
				<parameter name="address" value=""     />
				<parameter name="port"    value="10029" />
			</creation>
		</protocol>
		<protocol name="XMLRPC">
			<coordinations>
				<coordination>
					<parameter name="address" value="127.0.0.1:10129@PLD" />
				</coordination>
				<!-- <coordination>
					<parameter name="address" value="192.168.0.1:10129@LABORATORYNETWORK" />
				</coordination>
				<coordination>
					<parameter name="address" value="130.206.100.16:10129@INTERNET" />
				</coordination> -->
			</coordinations>
			<creation>
				<parameter name="address" value=""     />
				<parameter name="port"    value="10129" />
			</creation>
		</protocol>

	</protocols>
</server>

