<?xml version="1.0" encoding="UTF-8"?>
<server
	xmlns="http://www.weblab.deusto.es/configuration" 
	xmlns:xsi="http://www.w3.org/2001/XMLSchema-instance"
	xsi:schemaLocation="http://www.weblab.deusto.es/configuration server_configuration.xsd"
>

	<configuration file="server_config.py" />

	<type>weblab.data.server_type::UserProcessing</type>
	<methods>weblab.methods::UserProcessing</methods>

	<implementation>weblab.core.server.UserProcessingServer</implementation>

	<!-- <restriction>something else</restriction> -->

	<protocols>
		<!-- This server supports both Direct calls, as SOAP calls -->
		<protocol name="Direct">
			<coordinations>
				<coordination></coordination>
			</coordinations>
			<creation></creation>
		</protocol>
	</protocols>
</server>

