<?xml version="1.0" encoding="UTF-8"?>
<server
	xmlns="http://www.weblab.deusto.es/configuration" 
	xmlns:xsi="http://www.w3.org/2001/XMLSchema-instance"
	xsi:schemaLocation="http://www.weblab.deusto.es/configuration server_configuration.xsd"
>

	<configuration file="server_config.py" />

	<type>weblab.data.server_type::Login</type>
	<methods>weblab.methods::Login</methods>

	<implementation>weblab.login.server.LoginServer</implementation>

	<!-- <restriction>something else</restriction> -->

	<protocols>
		<!-- This server supports both Direct calls, as SOAP calls -->
		<protocol name="Direct">
			<coordinations>
				<coordination></coordination>
			</coordinations>
			<creation></creation>
		</protocol>
		<protocol name="SOAP">
			<coordinations>
				<coordination>
					<parameter name="address" value="127.0.0.1:10025@PLD" />
				</coordination>
				<coordination>
					<parameter name="address" value="192.168.0.1:10025@LABORATORYNETWORK" />
				</coordination>
				<coordination>
					<parameter name="address" value="130.206.100.16:10025@INTERNET" />
				</coordination>
			</coordinations>
			<creation>
				<parameter name="address" value=""     />
				<parameter name="port"    value="10025" />
			</creation>
		</protocol>
	</protocols>
</server>

